<MenuConf xmlns:xsi="http://www.w3.org/2001/XMLSchema-instance" xsi:noNamespaceSchemaLocation="schema.xsd">
	<!-- This are the menus that are available to display entries -->
	<Menus>
		<Menu ID="hycom" EN="HYCOM" ES="HYCOM"/>
		<Menu ID="GLBL" EN="Global Weather" ES="Global"/>
		<Menu ID="gfs" EN="GFS" ES="GFS"/>

		<Menu ID="abvgrnd"  EN="Above Ground" ES="Sobre Tierra" />
		<Menu ID="grnd"  EN="Ground" ES="En Tierra" />
		<Menu ID="geo"  EN="Geo Potential H." ES="Altura Geopot." />
		<Menu ID="cur"  EN="Currents" ES="Corrientes" />
		<Menu ID="cld"  EN="Cloud" ES="Nubes" />
		<Menu ID="ccov"  EN="Cloud Cover" ES="Covertura Nubes" />
		<Menu ID="conv"  EN="Potential Energy" ES="Energia Potencial" />
		<Menu ID="hum"  EN="Humidity" ES="Humedad" />
		<Menu ID="isobar"  EN="Isobaric" ES="Isobarica" />
		<Menu ID="msl"  EN="MSL" ES="MSL" />
		<Menu ID="ozone"  EN="Total Ozone" ES="Ozono Total" />
		<Menu ID="prec"  EN="Prec. Water" ES="Agua Prec" />
		<Menu ID="pres"  EN="Pressure" ES="Presion" />
		<Menu ID="plan"  EN="Planetary Height" ES="Altura Planetaria" />
		<Menu ID="surf"  EN="At Surface" ES="En Superficie" />
		<Menu ID="suri"  EN="Surface lifted idx." ES="Indice superficial" />
		<Menu ID="sun"  EN="Sunshine time" ES="Duracion sol" />
		<Menu ID="sal"  EN="Salinity" ES="Salinidad" />
		<Menu ID="ssh"  EN="Elevation" ES="Altura" />
		<Menu ID="tic"  EN="Ice Cover" ES="Hielo" />
		<Menu ID="twom"  EN="Two Meters" ES="A 2 metros" />
		<Menu ID="ts"  EN="Temperature" ES="Temperatura" />
		<Menu ID="wind"  EN="Wind" ES="Viento" />
		<Menu ID="vor"  EN="Vorticity" ES="Vorticidad" />
	</Menus>
        <!--HYCOM-->
	<MainLayers BBOX="-180,-90,180,90"
				format="image/gif"  server="http://132.248.8.238:8080/ncWMS_2015/wms"
				ncWMStwo="true" max_time_range="month">  

		<layer Menu="GLBL,hycom,cur" 
			   EN="Forecast currents"
			   name="hycom_forecast_uv/water_u:water_v-mag" 
			   defParticleSpeed=".9" overlaystreamlines="hycom_forecast_uv/water_u:hycom_forecast_uv/water_v" />

		<layer Menu="GLBL,hycom,ts" 
			   EN="Forecast temperature" 
			   name="hycom_forecast_ts/water_temp" 
                           palette="div-Spectral-inv"
			   defParticleSpeed=".9" overlaystreamlines="hycom_forecast_uv/water_u:hycom_forecast_uv/water_v" />

		<layer Menu="GLBL,hycom,sal" 
			   EN="Forecast salinity"
			   name="hycom_forecast_ts/salinity" 
			   defParticleSpeed=".9" overlaystreamlines="hycom_forecast_uv/water_u:hycom_forecast_uv/water_v" />

		<layer Menu="GLBL,hycom,ssh" 
			   EN="Forecast sea surface height"
			   name="hycom_forecast_ssh/surf_el" 
                           palette="adcirc"
			   defParticleSpeed=".9" overlaystreamlines="hycom_forecast_uv/water_u:hycom_forecast_uv/water_v" />

		<!--
		<layer Menu="GLBL,gfs,wind,abvgrnd" EN="Wind above ground" ES="Viento en superficie"
			   name="gfs_forecast/v_abvgrd:u_abvgrd-mag" defParticleSpeed=".05"  mincolor="0" maxcolor="70" belowMinColor="transparent" aboveMaxColor="transparent"
			   overlaystreamlines="gfs_forecast/v_abvgrd:gfs_forecast/u_abvgrd" palette="wind2"  />

		<layer Menu="GLBL,gfs,wind,isobar" EN="Isobaric wind" ES="Viento isobárico" 
			   name="gfs_forecast/v_isobar:u_isobar-mag" defParticleSpeed=".010" mincolor="0" maxcolor="70" belowMinColor="transparent" aboveMaxColor="transparent"
			   overlaystreamlines="gfs_forecast/v_isobar:gfs_forecast/u_isobar" palette="wind2" />
                
                <layer Menu="GLBL,gfs,ts,surf" EN="Surface temperature" mincolor="-40" maxcolor="50"
			   ES="Temperatura en superficie" name="gfs_forecast/temp_surf" palette="div-Spectral-inv" />
                
                
	   <layer Menu="GLBL,gfs,ts,abvgrnd" EN="Temperature above ground" palette="div-Spectral-inv" mincolor="-40" maxcolor="50"
			  ES="Temperatura sobre superficie" name="gfs_forecast/temp_abvgrd" />
           
	   <layer Menu="GLBL,gfs,ts,isobar" EN="Isobaric temperature" palette="div-Spectral-inv" mincolor="-40" maxcolor="50"
			  ES="Temperatura isobarica" name="gfs_forecast/temp_isobar" />
	   
           <layer Menu="GLBL,gfs,hum,twom" EN="Humidity at 2 mts" palette="prec" mincolor="0" maxcolor="100"  belowMinColor="transparent" aboveMaxColor="transparent"
			  ES="Humedad a 2 mts" name="gfs_forecast/humidity_twom" />
           
	   <layer Menu="GLBL,gfs,hum,isobar" EN="Isobaric humidity" palette="prec" mincolor="0" maxcolor="100"  belowMinColor="transparent" aboveMaxColor="transparent"
			  ES="Humedad isobarica" name="gfs_forecast/humidity_isobar" />
           
           <layer Menu="GLBL,gfs,prec" EN="Precipitation" 
			  ES="Precipitación" name="gfs_forecast/prec_water" palette="prec2" mincolor="1" maxcolor="400" />
           
           <layer Menu="GLBL,gfs,vor" EN="Vorticity" mincolor="-0.00001" maxcolor="0.001" belowMinColor="0x000000" aboveMaxColor="0xFFFFFF"
			  ES="Vorticidad" name="gfs_forecast/abs_vort" />
           
           <layer Menu="GLBL,gfs,pres,grnd" EN="Ground pressure"
			  ES="Presión" name="gfs_forecast/pres_grd" mincolor="47020" maxcolor="106300" />
           <layer Menu="GLBL,gfs,pres,msl" EN="MSL pressure"
			  ES="Presión MSL" name="gfs_forecast/pres_msl" mincolor="94260" maxcolor="105000" />
           
           <layer Menu="GLBL,gfs,geo" EN="Geo potential height" 
			  ES="Altura geo potencial "
			  name="gfs_forecast/geo_height_isobar" mincolor="-328" maxcolor="392" />
           
           <layer Menu="GLBL,gfs,plan" EN="Planetary height"
			  ES="Altura planetaria" name="gfs_forecast/plan_height" mincolor="-200" maxcolor="3630" />
           <layer Menu="GLBL,gfs,conv" EN="Potential energy"
			  ES="Energía potencial" name="gfs_forecast/conv_en" mincolor="-200" maxcolor="4150" />
	   <layer Menu="GLBL,gfs,suri" EN="Surface lifted index"
			  name="gfs_forecast/surf_idx" mincolor="-13" maxcolor="50" />
           
	   <layer Menu="GLBL,gfs,ozone" EN="Total ozone"  belowMinColor="0x000000" aboveMaxColor="0xFFFFFF"
			  ES="Ozono total" name="gfs_forecast/tot_ozone" mincolor="100" maxcolor="500" />
           
	   <layer Menu="GLBL,gfs,tic" EN="Ice cover"
			  ES="Hielo" name="gfs_forecast/tot_ice_cov" mincolor="-1" maxcolor="1.5" />
	   <layer Menu="GLBL,gfs,sun" EN="Sunshine time"
			  ES="Tiempo de sol" name="gfs_forecast/sun_dur" mincolor="-1079" maxcolor="22680" />

		-->
	</MainLayers> 
</MenuConf>
